{
  "datasetVersion": "multimodal-clinical-eye-mc-dropout-v1",
  "decisionThreshold": 0.402989898989899,
  "uncertaintyThreshold": 0.03879740765018785,
  "uncertaintyPassCount": 30,
  "deploymentStatus": "engineeringFixture",
  "input": {
    "colorSpace": "sRGB",
    "dataType": "uint8",
    "dimensions": [
      1,
      224,
      224,
      3
    ],
    "name": "image",
    "pixelFormat": "32BGRA"
  },
  "modelIdentifier": "org.ironscan.engineering.nail-pallor-proxy",
  "normalization": {
    "biases": [
      0.0,
      0.0,
      0.0
    ],
    "kind": "scale",
    "scale": 0.00392156862745098
  },
  "outputs": [
    {
      "dataType": "float32",
      "dimensions": [
        1
      ],
      "name": "raw_proxy_logit"
    },
    {
      "dataType": "float32",
      "dimensions": [
        1
      ],
      "name": "calibrated_proxy_probability"
    },
    {
      "dataType": "float32",
      "dimensions": [
        1
      ],
      "name": "predictive_uncertainty"
    }
  ],
  "preprocessingVersion": "multimodal-nail-1.0.0",
  "resize": {
    "interpolation": "vImageHighQuality",
    "method": "scaleFill"
  },
  "schemaVersion": 1,
  "semanticVersion": "0.3.0-engineering.1",
  "sha256": "759b73d628cb12135cfc09dbffa567698dfec513aea709abb82dd89c0ca56dfa",
  "trainingCommit": "a3b7f76a7a2e6174129c7ff0c5d571ef95926c4d"
}
